[
  {
    "model": "opus-4.8",
    "run_id": "r-opus-4.8",
    "id": "VERB-001",
    "type": "verbatim",
    "statement": "Participant described the work as babysitting the agent.",
    "method": "thematic",
    "method_justification": "Verbatim capture of the voice of the customer.",
    "confidence": "high",
    "evidence_mode": "participant_self_report",
    "supporting_participants": [
      "P01"
    ],
    "frequency": 1,
    "created_by": "verbatim",
    "evidence": [
      {
        "transcript_id": "P01",
        "participant": "P01",
        "locator": "00:09:40",
        "quote": "honestly I ended up babysitting it the whole time.",
        "clip_url": "https://heymarvin.com/clip/P01-000940",
        "clip_status": "created",
        "observation_type": "said",
        "source_type": "transcript_speech"
      }
    ]
  },
  {
    "model": "opus-4.8",
    "run_id": "r-opus-4.8",
    "id": "VERB-002",
    "type": "verbatim",
    "statement": "Participant valued the agent stating its plan up front.",
    "method": "thematic",
    "method_justification": "Verbatim capture of a positive expectation.",
    "confidence": "medium",
    "evidence_mode": "participant_self_report",
    "supporting_participants": [
      "P02"
    ],
    "frequency": 1,
    "created_by": "verbatim",
    "evidence": [
      {
        "transcript_id": "P02",
        "participant": "P02",
        "locator": "00:15:30",
        "quote": "I liked that it explained the plan before it started.",
        "clip_url": "https://heymarvin.com/clip/P02-001530",
        "clip_status": "created",
        "observation_type": "said",
        "source_type": "transcript_speech"
      }
    ]
  }
]