[
  {
    "model": "gpt-5.5",
    "run_id": "r-gpt-5.5",
    "id": "PAIN-001",
    "type": "pain_point",
    "statement": "Participants could not see what the agent changed and had to verify manually.",
    "method": "thematic",
    "method_justification": "Recurring high-severity pattern across participants.",
    "severity": 4,
    "confidence": "high",
    "evidence_mode": "participant_self_report",
    "supporting_participants": [
      "P01",
      "P02"
    ],
    "frequency": 2,
    "representativeness": "representative",
    "created_by": "pain-points",
    "evidence": [
      {
        "transcript_id": "P01",
        "participant": "P01",
        "locator": "00:02:15",
        "quote": "I couldn't tell what the agent had changed, so I opened every file to check.",
        "clip_url": "https://heymarvin.com/clip/P01-000215",
        "clip_status": "created",
        "observation_type": "said",
        "source_type": "transcript_speech"
      },
      {
        "transcript_id": "P02",
        "participant": "P02",
        "locator": "00:04:05",
        "quote": "it said it was done but I didn't trust that until I ran the tests myself.",
        "clip_url": "https://heymarvin.com/clip/P02-000405",
        "clip_status": "created",
        "observation_type": "said",
        "source_type": "transcript_speech"
      }
    ]
  },
  {
    "model": "gpt-5.5",
    "run_id": "r-gpt-5.5",
    "id": "PAIN-002",
    "type": "pain_point",
    "statement": "Waiting on the agent pushed a participant to redo the work manually.",
    "method": "thematic",
    "method_justification": "Distinct pain expressed with a fallback action.",
    "severity": 3,
    "confidence": "medium",
    "evidence_mode": "participant_self_report",
    "supporting_participants": [
      "P03"
    ],
    "frequency": 1,
    "representativeness": "illustrative",
    "created_by": "pain-points",
    "evidence": [
      {
        "transcript_id": "P03",
        "participant": "P03",
        "locator": "00:06:20",
        "quote": "I gave up waiting and just wrote the function by hand.",
        "clip_url": "https://heymarvin.com/clip/P03-000620",
        "clip_status": "created",
        "observation_type": "said",
        "source_type": "transcript_speech"
      }
    ]
  }
]