[
  {
    "model": "opus-4.8",
    "run_id": "r-opus-4.8",
    "id": "REC-001",
    "type": "design_recommendation",
    "statement": "Surface a visible diff of what the agent changed before asking for approval.",
    "method": "thematic",
    "method_justification": "Grounded in the relief a participant felt when a diff appeared.",
    "confidence": "high",
    "evidence_mode": "participant_self_report",
    "supporting_participants": [
      "P03"
    ],
    "frequency": 1,
    "representativeness": "illustrative",
    "related_finding_ids": [
      "PAIN-001"
    ],
    "created_by": "design-recommendations",
    "evidence": [
      {
        "transcript_id": "P03",
        "participant": "P03",
        "locator": "00:11:10",
        "quote": "the diff view finally showed me what happened and I relaxed.",
        "clip_url": "https://heymarvin.com/clip/P03-001110",
        "clip_status": "created",
        "observation_type": "said",
        "source_type": "transcript_speech"
      }
    ]
  }
]