[
  {
    "model": "gpt-5.5",
    "run_id": "r-gpt-5.5",
    "id": "PAPER-001",
    "type": "papercut",
    "statement": "A done status did not feel trustworthy without a manual test run.",
    "method": "thematic",
    "method_justification": "Small repeated friction that erodes trust.",
    "severity": 2,
    "confidence": "medium",
    "evidence_mode": "participant_self_report",
    "supporting_participants": [
      "P02"
    ],
    "frequency": 1,
    "representativeness": "illustrative",
    "created_by": "papercuts",
    "evidence": [
      {
        "transcript_id": "P02",
        "participant": "P02",
        "locator": "00:04:05",
        "quote": "it said it was done but I didn't trust that until I ran the tests myself.",
        "clip_url": "https://heymarvin.com/clip/P02-000405",
        "clip_status": "created",
        "observation_type": "said",
        "source_type": "transcript_speech"
      }
    ]
  }
]